{
  "kind": "editspace.operations",
  "v": 1,
  "doc": "scene",
  "ops": [
    { "doc": "scene", "op": "ada:1", "actor": "ada", "seq": 1, "action": "create", "entity": "object", "target": "cube" },
    { "v": 1, "doc": "scene", "op": "ada:1", "actor": "ada", "seq": 1, "deps": [], "action": "create", "entity": "object", "target": "cube", "fields": {}, "args": {}, "features": [] }
  ]
}
